{
  "schema": "change_revision_v1",
  "tenant_id": "synthetic-tenant-a",
  "change_id": "00000000-0000-4000-8000-00000000000a",
  "revision": 1,
  "status": "DRAFT",
  "title": "Synthetic demonstration change",
  "pack_version_id": "synthetic.auto.v1",
  "product_id": "SYNTH-AUTO-101",
  "workflow": "CLAIM_REVIEW",
  "rule_key": "DOCUMENT_WINDOW_DAYS",
  "candidate_snapshot_id": "00000000-0000-4000-8000-000000000001",
  "source_bundle_id": "00000000-0000-4000-8000-000000000002",
  "dataset_version_id": "00000000-0000-4000-8000-000000000003",
  "suite_version_id": "00000000-0000-4000-8000-000000000004",
  "evaluator_version_id": "00000000-0000-4000-8000-000000000005",
  "requester_id": "synthetic-requester",
  "owner_id": "synthetic-requester",
  "domain_reviewer_id": null,
  "release_approver_id": null,
  "active_run_id": null,
  "active_job_id": null,
  "parent_change_id": null,
  "parent_relation": null,
  "assessment_sha256": null,
  "created_at": "2026-10-29T03:34:56.123456Z",
  "updated_at": "2026-10-29T03:34:56.123456Z"
}
